{
  "comment": "v2 socket ring. Retired with the freeform pegboard: the OBSERVE block and its 'no_observe' failure mode (observation is now automatic and SHOWN — every failing check's output visibly flows back into the agent's context mid-run) and the ESCALATE block. SQUINT AT IT inherits the subjective-verifier prose; the single STOP socket takes one config card instead of three stop blocks.",
  "nodes": {
    "trigger": {
      "label": "TRIGGER",
      "sub": "issue opened",
      "desc": "Starts the loop: schedule, file change, issue opened, CI failure, manual. Something has to ask."
    },
    "agent": {
      "label": "AGENT",
      "sub": "the model acts",
      "desc": "The model edits the code. It is confident. Confidence is not a metric."
    },
    "stop": {
      "label": "STOP",
      "sub": "needs a config",
      "desc": "How the loop ends. Seat a config card. A loop with no exit is called a career."
    },
    "gate": {
      "label": "HUMAN GATE",
      "sub": "a person, every lap",
      "desc": "Pause for a person each iteration. Powerful once. On every lap, the person is the loop."
    }
  },
  "checks": [
    {
      "id": "run_build",
      "label": "RUN BUILD",
      "sub": "does it compile",
      "desc": "The compiler reads every line and holds a grudge. Machine-checkable. It cannot be flattered.",
      "passLine": "BUILD ✓ — compiles clean.",
      "failLine": "BUILD ✗ — 2 errors: 'ledger' is not defined. Neither is 'ledgar'.",
      "closerLine": "BUILD ✗ — 1 error left. The grudge is narrowing.",
      "feedbackLine": "the build errors flow back into the agent's context. It reads them. All of them."
    },
    {
      "id": "run_lint",
      "label": "RUN LINT",
      "sub": "is it tidy",
      "desc": "Opinions — but codified, numbered, and enforced by a machine. That promotion makes them checks.",
      "passLine": "LINT ✓ — 0 warnings. The style guide sleeps.",
      "failLine": "LINT ✗ — 14 warnings, incl. one unused import carrying emotional weight.",
      "closerLine": "LINT ✗ — 3 warnings left, all in the file it just touched.",
      "feedbackLine": "the lint report flows back into the agent's context. It reads the warnings."
    },
    {
      "id": "run_ui_tests",
      "label": "RUN UI TESTS",
      "sub": "a robot clicks",
      "desc": "A small browser opens and a robot clicks the button like a customer who has read nothing.",
      "passLine": "UI TEST ✓ — the button does the thing. A robot confirmed it.",
      "failLine": "UI TEST ✗ — clicked SAVE. Nothing saved. Screenshot attached, damning.",
      "closerLine": "UI TEST ✗ — SAVE saves now. UNDO un-does slightly too much.",
      "feedbackLine": "the failing screenshot flows back into the agent's context. It looks at it."
    },
    {
      "id": "squint",
      "label": "SQUINT AT IT",
      "sub": "looks good",
      "desc": "A vibe with a socket. Accepts compliments. Returns opinions. Counts as nothing.",
      "passLine": "SQUINT — looks good from here. (This proved nothing.)",
      "failLine": "SQUINT — hmm. Looks... fine?",
      "closerLine": "SQUINT — still looks fine. Everything always has.",
      "feedbackLine": "an opinion flows back into the agent's context. It was not information."
    }
  ],
  "stops": [
    {
      "id": "cap",
      "label": "ITERATION CAP",
      "sub": "max 10 tries",
      "desc": "A maximum number of tries. Hope is not a maximum."
    },
    {
      "id": "budget",
      "label": "SPEND BUDGET",
      "sub": "max 20 tokens",
      "desc": "A spending limit. The invoice arrives either way; this decides the font size."
    },
    {
      "id": "both",
      "label": "CAP + BUDGET",
      "sub": "belt and braces",
      "desc": "Tries capped AND spend capped. The loop ends on purpose, whichever limit arrives first."
    },
    {
      "id": "none",
      "label": "NONE",
      "sub": "it'll stop itself",
      "desc": "No cap, no budget, no exit but success. Optimism, socketed."
    }
  ],
  "run": {
    "start": "RING ENERGIZED. Current on the line.",
    "triggerLine": "TRIGGER — issue #4198: 'button does nothing (the main button)'.",
    "agentLines": [
      "AGENT — reads the issue, edits src/button.ts. First attempt, full confidence.",
      "AGENT — reads what the check said. Edits again, chastened.",
      "AGENT — third pass. The checks steered; the agent merely drove."
    ],
    "stopLine": "STOP — checks green. The loop exits on purpose. Under cap. Under budget.",
    "squintPassLine": "SQUINT — also looks good. Nobody asked, but it also looks good.",
    "gateEscortLine": "GATE — a human approved lap {n}. The human added nothing, warmly.",
    "scoreLine": "Efficient loop. Tokens banked: {banked}."
  },
  "fork": {
    "title": "THE LOOP FORK",
    "intro": [
      "The road forks. One side is a LOOP. The other is a GRAPH. Two jobs are nailed to the signpost.",
      "JOB A — FORMAT THE LEDGER. Known shape, known steps. A pipeline.",
      "JOB B — THE WAGON WHEEL SQUEAKS SOMEWHERE. Nobody knows where. A surprise."
    ],
    "graph": {
      "hint": "GRAPH side first. Seat PLAN, two parallel STEPs, and a MERGE GATE. Every node runs exactly once.",
      "nodes": {
        "plan": {
          "label": "PLAN",
          "desc": "Splits the job into two halves. Once. Up front. With total certainty."
        },
        "step_a": {
          "label": "STEP",
          "desc": "Does its half. Exactly once. Asks nothing. Checks nothing."
        },
        "step_b": {
          "label": "STEP",
          "desc": "Does the other half. Also once. Also asks nothing."
        },
        "merge": {
          "label": "MERGE GATE",
          "desc": "Waits for both halves, staples them together, declares the job done."
        }
      },
      "doneLabel": "DONE",
      "runA": [
        "GRAPH · JOB A — PLAN: split the ledger. Columns left, rows right.",
        "STEP ‖ STEP — columns aligned; rows dated. In parallel. No drama.",
        "MERGE GATE — both halves agree. Stapled.",
        "DONE ✓ — ledger formatted. 6 tokens, one pass. The graph knew the shape of the job."
      ],
      "runB": [
        "GRAPH · JOB B — PLAN: 'a squeak is an axle problem.' Decided. Once.",
        "STEP ‖ STEP — axle greased; bolts tightened. In parallel. With conviction.",
        "MERGE GATE — both halves report success. Stapled.",
        "DONE ✓ — shipped: 'wheel fixed.'",
        "The squeak continues. It was the door. Every node ran. No node listened."
      ],
      "verdict": "The graph is deterministic: every node runs once, the cost is predictable — and nothing in it can notice it was wrong."
    },
    "loop": {
      "hint": "Now the LOOP side. Seat real checks and a stop config, then RUN the same two jobs.",
      "runA": [
        "LOOP · JOB A — lap 1: formats the columns. BUILD ✗ — a stray comma in the ledger parser.",
        "lap 2: comma removed. BUILD ✓ LINT ✓ — rows still undated.",
        "lap 3: rows dated. Checks green. STOP.",
        "DONE ✓ — ledger formatted. 14 tokens. The loop paid 8 extra to double-check a job the graph already knew."
      ],
      "runB": [
        "LOOP · JOB B — lap 1: greases the axle. UI TEST ✗ — the squeak is audibly still there.",
        "the failing check flows back into the agent's context. It stops believing the axle theory.",
        "lap 2: follows the sound instead. It is the door hinge. Oils it. UI TEST ✓ — silence.",
        "STOP — checks green. DONE ✓ — squeak found and fixed. Nobody told it where to look."
      ],
      "verdict": "The loop is adaptive: it costs more per job — and it is the only one that noticed."
    },
    "tally": [
      "JOB A (pipeline) — GRAPH ✓ 6 tk · LOOP ✓ 14 tk. The graph wins on price.",
      "JOB B (surprise) — GRAPH × shipped the wrong fix · LOOP ✓ converged. The loop wins on truth."
    ],
    "banner": "GRAPHS FOR PIPELINES. LOOPS FOR SURPRISES.",
    "moral": "When you can draw the steps in advance, draw them. When you can't, build a loop and let the checks steer."
  },
  "ridge": {
    "intro": "The bridge is missing one plank. The gap is shaped exactly like a real check.",
    "plate": "NO REAL CHECK - NO EXIT",
    "retreatDenied": "There is no way back. The trail behind you has been deprecated.",
    "squintDenied": "SQUINT AT IT does not count. The bridge inspector is a machine. It cannot be flattered.",
    "crossSuccess": [
      "The plank fits. Machine-checked. The bridge holds because holding is testable.",
      "The party crosses while the loop runs on. Nobody watches. That was the point."
    ],
    "crossGated": "You crossed. You personally inspected every plank. It took eleven days.",
    "banked": "+40 UNATTENDED MILES. THE PARTY SLEPT. THE LOOP DID NOT."
  },
  "tutorial": {
    "prompt": "You are a world-class principal staff senior engineer. Think step by step. Be correct. Do not be incorrect. My career depends on this. (revision 41, framed)",
    "fires": [
      [
        "PROMPT fired. 62% of the task appears, fully formed, in one pass.",
        "It is genuinely impressive. The remaining 38% is load-bearing."
      ],
      [
        "PROMPT fired again, louder. 64%.",
        "The same missing part is missing, with better formatting."
      ],
      [
        "Persona added. Threat added. 65%.",
        "The prompt is now longer than the task."
      ]
    ],
    "ceremony": "Fort Prompt records this as its best result in two years. There is a ceremony.",
    "loopIntro": "A settler whispers: some parties wire a CHECK to the output and feed what it says back in.",
    "loopLines": [
      "LAP 1 — act. UI TEST ✗. The failure flows back in: 74%. It found the missing part by looking.",
      "LAP 2 — act. UI TEST ✗, but nearer: 83%. No inspiration was involved.",
      "LAP 3 — act. UI TEST ✗: 91%. The prompt has not changed once.",
      "LAP 4 — act. UI TEST ✗, barely: 97%. The fort has gone quiet.",
      "LAP 5 — act. UI TEST ✓: 100%. Done. Verified. Boring."